{
  "prompt": "Ball bounces once on your side, near the kitchen line.",
  "scene": {
    "kind": "court-diagram",
    "diagramId": "pickleball-court",
    "markers": [
      {
        "role": "player",
        "x": 0.5,
        "y": 0.62
      },
      {
        "role": "ball",
        "x": 0.5,
        "y": 0.35
      }
    ],
    "alt": "Pickleball court. You stand just behind the kitchen line; the ball is coming over the net."
  },
  "choices": [
    {
      "id": "volley",
      "label": "Volley it"
    },
    {
      "id": "bounce",
      "label": "Let it bounce"
    }
  ],
  "correctChoiceId": "volley",
  "explanation": {
    "correct": "You are outside the kitchen, so volleying is legal.",
    "incorrect": "Standing outside the kitchen you may volley. The no-volley rule applies only inside it."
  },
  "ruleTag": "Kitchen rule"
}
